PARENT,PARENT SCOPE,CODE,NAME,NAME_EN,NAME_RU,NAME_AR,BUDGET,ACTUAL
01,8452|845|84|8,1.845201.840,מסגרות יום ארוך-הוצ.,Extended day programs for the mentally retarded - expenses,,,0,0
02,8452|845|84|8,1.845202.840,מפגרים במעון טפולי-הוצ.,Mentally retarded in theraputic daycare - expenses,,,372000,370527
03,8452|845|84|8,1.845203.840,מעשי'ם-הוצ.,Sheltered employment for the mentally retarded - expenses,,,50000,48360
01,8453|845|84|8,1.845301.840,שרותים תומכים למפגר-הוצ,Supportive services for the mentally retarded - expenses,,,17000,14392
02,8453|845|84|8,1.845302.840,נופשונים למפגר-הוצ.,Respite care for the mentally retarded - expenses,,,17000,26308
03,8453|845|84|8,1.845303.840,הסעות למ.יום למפגר-הוצ.,Transportation to daycare centers for the mentally retarded - expenses,,,10000,0
01,8461|846|84|8,1.846101.840,ילדים עוורים במוסדות-הוצאות,Blind children in institutions - expenses,,,48000,9963
01,8463|846|84|8,1.846301.840,דמי לווי לעוור-הוצ.,Accompanyment fee for the blind - expenses,,,0,0
02,8463|846|84|8,1.846302.840,הדרכת עוור ובני ביתו-הו,Training for the blind and family in the home - expenses,,,0,9467
03,8463|846|84|8,1.846303.840,שיקום העיוור בקהילה-הוצ,Rehabilitation for the blind in the community - expenses,,,0,0
01,8464|846|84|8,1.846401.840,מפעלי שיקום לעוור-הוצאות,Rehabilitation production plants for the blind - expenses,,,0,2461
8465,,1.846500.840,אחזקת נכים בפנימיות-הוצ,Physcially disabled in boarding facilities,,,734000,736939
01,8466|846|84|8,1.846601.840,תעסוקה מוגנת למוגבלי.הו,Sheltered employment for the physically disabled,,,28000,38717
02,8466|846|84|8,1.846602.840,מס.יום לילד המוגבל-הוצ.,Daycare facility for physically disabled children - expenses,,,12000,11766
01,8467|846|84|8,1.846701.840,תוכניות לילד החריג-הוצ.,Programs for exceptional children - expenses,,,14000,18795
02,8467|846|84|8,1.846702.840,הסעות למ.יום שיקומי לנכים-הוצ.,Transportation to rehabilitation daycare centers for the physically disabled - expenses,,,556000,552002.24
03,8467|846|84|8,1.846703.840,מ.יום שיקומי לנכים-הוצ.,Rehabilitation daycare centers for the physically disabled - expenses,,,670000,667304
04,8467|846|84|8,1.846704.840,ליווי למ.יום שקומי-הוצ.,Accompanyment to rehabilitation daycare centers - expenses,,,52000,124996.36
05,8467|846|84|8,1.846705.840,נופשונים להבראה-הוצאות,Respite care for the physically disabled - expenses,,,17000,15354
06,8467|846|84|8,1.846706.840,חלופה למ.יום שיקומי לנכים-הוצ.,Alternative to rehabilitation daycare centers - expenses,,,0,21500
07,8467|846|84|8,1.846707.840,תעסוקה נתמכת לנכים-הוצאות,Supported employment the for physically disabled - expenses,,,0,11664
01,8468|846|84|8,1.846801.840,מרכזי איבחון ושיקום-הוצ,Diagnosis and rehabilitation centers for the physically disabled - expenses,,,33000,1674
02,8468|846|84|8,1.846802.840,שיקום נכים בקהילה-הוצ.,Rehabilitation of the physically disabled in the community - expenses,,,7000,14084
03,8468|846|84|8,1.846803.840,דמי תקשורת לחרשים-הוצ.,Communication fees for the deaf - expenses,,,0,0
04,8468|846|84|8,1.846804.840,מועדונים לעיוור-הוצאות,Clubs for the blind - expenses,,,1000,0
04,8471|846|84|8,1.847104.840,טיפול בנוער ובצעירים-הו,Treatment of youth and adolescents  - expenses,,,20000,20450
05,8471|846|84|8,1.847105.840,טיפול בנערות במצוקה-הוצ,Treatment of young girls in distress  - expenses,,,33000,24643
06,8471|846|84|8,1.847106.840,מקלטים לנערות-הוצ.,Shelters for young girls  - expenses,,,21000,0
02,8473|846|84|8,1.847302.840,טפול באלכוהוליסטים-הוצ.,Treatment of alchololics  - expenses,,,20000,3617
03,8473|846|84|8,1.847303.840,סמים-טיפול בקהילה-הוצ.,Treatment in the community of drug abuse  - expenses,,,0,0
04,8473|846|84|8,1.847304.840,מ.יום לנוער סמים-הוצ.,Daycare center for youth addicted to drugs  - expenses,,,0,14558
8474,847|84|8,1.847400.840,מפת'ן מקומי - החזקה-הוצ,Local youth employment factory maintenance expenses,,,14000,17591
01,8482|846|84|8,1.848201.840,לכידות חברתית-הוצ.,Social coherence community center - expenses,,,133000,139640.6
02,8482|846|84|8,1.848202.840,הסעות במועצות אזוריו.הו,Transportation in local councils - expenses,,,120000,96000
01,849|84|8,1.849001.840,משפחות עולים במצוקה-הוצ,Immigrant/olim families in distress - expenses,,,4000,2547
02,849|84|8,1.849002.840,מעונות יום - עולים-הוצ.,Daycare centers for Immigrants/olim,,,26000,0
03,849|84|8,1.849003.840,ילדים במצוקה - עולים-הו,Immigrant/olim children in distress - expenses,,,6000,4730
04,849|84|8,1.849004.840,טיפול בזקנים - עולים-הו,Treatment of elderly immigrants/olim - expenses,,,4000,11780
06,849|84|8,1.849006.840,טפול בצעירים - עולים-הו,Treatment of youth immigrants/olim  - expenses,,,0,0
851,,1.851000.810,השת.במועצות דתיות,Payment for religious councils,,,1105000,1102082
86,8,1.860000.110,שכר-קליטת עליה והתנדבות,Salaries - absorption of olim and volunteering ,,,0,0
87,,1.870000.810,הש.אג.ערים אכות סביב,Payments to the Association of Cities for Environmental Protection,,,121000,111804
935,,1.935000.110,שכר-פיקוח קרקעות,Salary - land inspection,,,192000,195769.79
935,,1.935000.580,הוצאות ארגוניות-קרקעות,Organizational expenses - land,,,0,918
935,,1.935000.734,מגנום פיקוח 33-730-35,Magnum - land inspection,,,0,0
935,,1.935000.737,דימקס 44-907-72 פיקוח קרקע,D-Max land inspection,,,50000,63724.75
935,,1.935000.740,כלים וציוד-פקוח קרקע,Tools and equipment - land inspection,,,10000,244
935,,1.935000.750,ע.קבלניות-קרקעות,Contractor projects - land inspection,,,10000,0
94,9,1.940000.110,שכר-קצין בטיחות רכב,Salary - Vehicle security officer,,,192000,194004.25
94,9,1.940000.533,מזד3 הנדסה חלפ8752159 מ-1/12,Mazda 3 - engineering from 1/12,,,0,52906.39
94,9,1.940000.710,עב.קבל.הסעת עובדים,Contractor for employee transportation,,,60000,59349
94,9,1.940000.780,הוצ.שונות-תחבורה,Misc expenses - transportation,,,60000,31277.99
94,9,1.940000.930,קנית כלי רכב,Procuement of vehicles,,,0,0
971,,1.971000.110,שכר-ביוב,Salary - sewage department,,,500000,526583.25
971,,1.971000.530,מזד.3 מח'ביוב 53-183-65 מ-2/12,Mazda 3 - sewage department,,,0,50893.59
971,,1.971000.730,רכב ביוב 97-014-19,Sewage vehicle,,,0,0
971,,1.971000.733,מגנום ביוב 9583710 נמכר 3/12,Magnum - sewage department sold 3/12,,,0,5127.41
971,,1.971000.734,ג'מפי 42-499-57 מח'ביוב,Citroen Jumpy - sewage department,,,50000,15901.85
971,,1.971000.735,פורד ביוב 68-888-63 מ-3/11,Ford - sewage department from 3/11,,,60000,112887.97
971,,1.971000.737,מג.ביוב 5494236 מ9/08,Magnum - sewage department from 9/08,,,60000,73104.83
971,,1.971000.740,גרור ביוב 95-971-14 ויינגולד,Sewage tow,,,1000,4080.41
971,,1.971000.750,הוצאות ביוב,Sewage expenses,,,1690000,1687146.61
971,,1.971000.751,שאיבת בורות שופכין,Cesspool pumping,,,340000,338136
99,,1.990000.910,השת.בתקציב בלתי רגיל,Payment to irregular budget,,,6750000,6750000
99,,1.990000.920,תשלומים בלתי רגילים,Irregular payments,,,0,72000
991,,1.991000.810,השתתפות בקרן גוש-עציון,Payments to the Gush Etzion fund,,,220000,220000
994,,1.994000.110,שכר גימלאים,Pensioners salaries,,,2300000,2334851.82
994,,1.994000.810,השתתפות בפנסיה לגימלאים,Payments to pensioners pension fund,,,7000,9768
994,,1.994000.970,מקדמה על הוצ.עודפות,Down payment on expense surpluses,,,100000,92447
995,,1.995000.860,הנחות לזכאים ארנונה-הוצ,Property tax discount for those entitled - expense,,,1600000,1661163.35
995,,1.995000.861,הנחות מימון ארנונה-הוצ.,Discount on property tax financing - expense,,,250000,267755.12