PARENT,PARENT SCOPE,CODE,NAME,NAME_EN,NAME_RU,NAME_AR,BUDGET,ACTUAL
111,,1.111000.100,ארנונה כללית,Property tax,,,20000000,21109464.05
113,,1.113000.100,הנחות מימון-ארנונה,Property tax-Financing expenses,,,250000,267755.12
115,,1.115000.100,הנחות לזכאים-ארנונה,Property tax-eligibility discounts,,,1600000,1661163.35
191,,1.191000.910,מענק כללי לאיזון,General balancing grant,,,13144000,13143418.55
192,,1.192000.910,מענק חד-פעמי יעודי,One-time dedicated grant,,,15353000,15551946.5
2123,,1.212300.220,אגרת אסוף ובעור אשפה,Garbage collection and disposel fee,,,780000,736520
2123,,1.212300.490,הכנסות מתאגיד תמיר,Incomes from Tamir corporation,,,0,0
214,,1.214000.220,אגרת פיקוח וטרינרי,Veterinary inspection fee,,,0,42433
214,,1.214000.221,אג.חסון והסגר כלבים,Dog's vaccine & quarantine fee,,,50000,49295.89
215,,1.215000.220,אגרת הדברת מזיקים,Pesticides fee,,,20000,15682
222,,1.222000.500,החזר שכר רבשצ וסייר-מת',Security & patrol coordinator wage returns ,,,0,0
2221,,1.222100.990,הכנסות-משמר אזרחי,Incomes - civil police,,,6000,6165
227,,1.227000.970,מענק פקער-הגמר,Grant - civil defence,,,2200000,2002839.01
231,,1.231000.220,אג.מכרזים ושר.הנדסה,Tender & engineering service fee,,,30000,24850
231,,1.231000.590,העברה מקרן היטל השבחה,Transfers from betterment levy,,,0,0
233,,1.233000.220,אגרת רשיונות בניה,Building license fee,,,1160000,1199407.3
233,,1.233000.221,העתקי טפסים-מחלקת הנדסה,Forms copies - engineering department,,,0,400
242,,1.242000.290,הכנסות מעבודות שונות,Incomes - general works,,,1035000,1046273
269,,1.269000.500,החזר שכר כללי,General wage return,,,35000,59034.01
269,,1.269000.640,הכנסות שכר דירה,Income - apartment rents,,,55000,55072
269,,1.269000.690,הכנסות שונות,incomes - general,,,40000,24559.78
311,,1.311000.420,הכ'הורים-מפעל הזנה לאומ,"Incomes - parents, national feeding plan ",,,850000,877009.2
311,,1.311000.920,הסעת מורים וגננות,Teacher's transportaion,,,1500000,1406650.39
311,,1.311000.922,מ.חינוך-הכ.תקשוב לאומי,Ministry of Education - national ICT ,,,0,0
3111,311|31|3,1.311100.490,שונות-חנוך,Education - misc.,,,20000,14550
03,3122|312|31|3,1.312203.410,שכר לימוד-גני מועדון צה,Tuition - extended day preschool program,,,26000,35000
10,3122|312|31|3,1.312210.410,שכר לימוד גני-ילדים,Tuition - preschools,,,2350000,2119649.7
10,3122|312|31|3,1.312210.790,השת.ב'ל-גנים טיפוליים,?? Payment - Special education / theraputic preschools,,,0,0
10,3122|312|31|3,1.312210.920,הכנסות יוח'א גנים,Income form extended day preschool programs,,,360000,357658.46
10,3122|312|31|3,1.312210.922,סייעות טיפוליות-גנים,Assistants for special education / theraputic preschools,,,14000,67540.97
10,3122|312|31|3,1.312210.923,גננות שי'ח וח'מ,Special education preschool teachers ,,,0,0
10,3122|312|31|3,1.312210.940,סיעת רפואית גנים-מ.בריאות,Medical assistant for preschools - payment by Ministry of Health,,,0,0
10,3123|312|31|3,1.312310.420,גנים עודפים בישובים,Kindergarten surplus in communities,,,0,0
10,3123|312|31|3,1.312310.920,שכל'מ ועו'ג-גנים,Tuition and ?? kindergartens ,,,10358000,11020576.39
10,3124|312|31|3,1.312410.410,השתתפות הורים-מעונות,Day care centers - parent payments,,,0,6288.26
10,3124|312|31|3,1.312410.930,השתתפות ממשלה-מעונות,Day care centers - Government payments,,,5700000,5524727
11,3132|313|31|3,1.313211.420,הורים-ח.משלים-אלו'ש,Alon Shvut community supplemental education program - parent payments,,,810000,733533.38
11,3132|313|31|3,1.313211.421,שונות ח.משלים-אלו'ש,Alon Shvut community supplemental education program - misc.,,,0,21649.5
11,3132|313|31|3,1.313211.920,"שרתים,מזכירים-אלו'ש","Alon Shvut community maintenance workers, secretaties",,,456000,480867.31
11,3132|313|31|3,1.313211.921,מ.חנוך-ח.משלים-אלו'ש,Alon Shvut community supplemental education program - Ministry of Education payment,,,40000,205042.92
11,3132|313|31|3,1.313211.922,סייעות כיתתיות-ביס אלוש,Alon Shvut school - class teaching assistants,,,430000,566898.48
11,3132|313|31|3,1.313211.923,מ.חנוך-פרויקט יהדות-אלו,Alon Shvut Judaism Project - Ministry of Education payment,,,80000,18458.88
11,3132|313|31|3,1.313211.924,"מ.חינוך-השת.בטיולים-אלו""ש",Alon Shvut school trips - Ministry of Education payment ,,,0,25030.23
12,3132|313|31|3,1.313212.420,הורים-חנ.משלים-ממד 2 ג',"Supplemental education program, regional state religious school 2 - parent payments",,,1130000,991190.07
12,3132|313|31|3,1.313212.421,שונות חנ.משלים-ממד 2 ג',"Supplemental education, regional state religious school 2- misc.",,,0,44933
12,3132|313|31|3,1.313212.920,"שרתים,מזכירים-ממד 2 ג'צ","Maintenance, secretaties regional state religious school 2",,,550000,600320.7
12,3132|313|31|3,1.313212.921,מ.חנוך-ח.משלים-ממד 2 ג',"Supplemental education program, regional state religious school 2 - Ministry of Education payments",,,40000,62600
12,3132|313|31|3,1.313212.922,סייעות כיתתיות-ממד 2 ג',"Class teaching assistants, regional state religious school 2",,,612000,640048.48
12,3132|313|31|3,1.313212.923,מ.חנוך-ח.מיוחד-ממד 2 ג',"Special education, regional state religious school 2 - Ministry of Education payments",,,40000,48516.2
12,3132|313|31|3,1.313212.924,"מ.חינוך-השת.בטיולים-ג""צ",School trips - Ministry of Education payments,,,0,12185.41
12,3132|313|31|3,1.313212.940,סיעת רפואית ג'צ-מ.בריאו,Medical assistant  - Ministry of Health payment ,,,0,0
13,3132|313|31|3,1.313213.430,השת.רשויות-סייעות ראשית,"Assitants - ""Reysheet"" special education state religious school, local councils' payments",,,205000,259722
13,3132|313|31|3,1.313213.920,"שרתים,מזכירים-ב'ס ראשית","Maintenance, secretaties Reysheet School ",,,580000,630046.53
13,3132|313|31|3,1.313213.921,מ.חנוך-חנוך מיוחד-ראשית,Special education Reysheet school - Ministry of Education payments,,,90000,119247.55
13,3132|313|31|3,1.313213.922,מ.חנוך-סייעות-ב'ס ראשית,Assitants - Reysheet  school - Ministry of Education payments,,,473000,555920.87
13,3132|313|31|3,1.313213.923,מ.חנוך-השת'בשכ'ד-ראשית,Reysheet school rent - Ministry of Education payments,,,110000,38610
13,3132|313|31|3,1.313213.924,מ.חינוך-השת.בטיולים-ראשית,Reysheet school trips - Ministry of Education payments,,,0,19386.4
14,3132|313|31|3,1.313214.420,הורים-ח.משלים-תקוע,Supplemental education program Tkoa settlement,,,307000,434925.95
14,3132|313|31|3,1.313214.920,"שרתים,מזכירים-תקוע","Maintenance, secretaries, Tkoa settlement",,,280000,361839.61
14,3132|313|31|3,1.313214.921,מ.חנוך-ח.משלים-תקוע,"Supplemental education program, Tkoa settlement- Ministry of Educaiton payments",,,0,38898.1
14,3132|313|31|3,1.313214.922,סייעות טיפוליות-ביס תקו,Therapy assistants Tkoa school,,,180000,221438.28
14,3132|313|31|3,1.313214.924,מ.חינוך-השת.בטיולים-תקוע,Tkoa school trips - Ministry of Education payments,,,0,11797.1
15,3132|313|31|3,1.313215.420,הורים-ח.משלים-אזורי בנות,Supplemental educuation program Regional School for Girls - parent payments,,,836000,689179.65
15,3132|313|31|3,1.313215.421,שונות ח.משלים-אזורי בנות,Supplemental education program Regional School for Girls - misc.,,,0,65243
15,3132|313|31|3,1.313215.920,"שרתים,מזכירים-אזורי בנות","Maintenance, secretaries Regional School for Girls",,,420000,398235.01
15,3132|313|31|3,1.313215.921,מ.חנוך-ח.משלים-אזורי בנות,Supplemental education program Regional School for Girls - Ministry of Education payments,,,0,57004.7
15,3132|313|31|3,1.313215.922,סייעות שונות-אזורי בנות,Misc assistants Regional School for Girls,,,153000,159506.17
15,3132|313|31|3,1.313215.923,מ.חנוך-פרויקט יהדות-אזורי בנות,Judaism Project Regional School for Girls - Ministry of Education payments,,,20000,0
15,3132|313|31|3,1.313215.924,מ.חינוך-השת.בטיולים-בנות,School trips - Regional School for Girls - Ministry of Education payments,,,0,24315.44
20,3132|313|31|3,1.313220.430,אגרת הוצ.חנוך-ילדי חוץ,School expenditure fee - external students ,,,500000,483365
20,3132|313|31|3,1.313220.431,סייעות לילדי רשויות חוץ,Assistants for students from external communities,,,0,39922
20,3132|313|31|3,1.313220.790,השתתפות מוסדות בחנוך,Institutional payments in education,,,0,0
20,3132|313|31|3,1.313220.921,חנוך משלים ושר.אחרים,Supplemental educational programs and other ,,,0,5510
20,3132|313|31|3,1.313220.922,סייעות טיפוליות-ביס שונ,Therapy assistants - various schools,,,247000,269833.32
21,3132|313|31|3,1.313221.420,הורים-ח.משלים-מ.עמוס,Supplemental education program Maale Amos school - parent payments,,,2000,3476.3
21,3132|313|31|3,1.313221.920,שרתים מזכירים-ביס מ.עמו,"Maintenance, secretaries - Maale Amos school",,,230000,268331.76
21,3132|313|31|3,1.313221.921,מ.חנוך-ח.משלים-מ.עמוס,Supplemental education program Maale Amos settlement- Ministry of Education payments,,,0,0
21,3132|313|31|3,1.313221.924,מ.חינוך-השת.בטיולים-מ.עמוס,School trips Maale Amos settlement- Ministry of Education payments,,,0,0
22,3132|313|31|3,1.313222.420,השת.הורים-ח.משלים-תת ב',Supplemental education program Talmud Tora Bat Ayin- parent payments,,,2000,5329.4
3134,313|31|3,1.313400.420,"השתתפות הורים-בי""ס אפיקים למחוננים",Afikim School for Gifted Children - parent payments,,,1000,0
3134,313|31|3,1.313400.430,"השתתפות רשויות-ב""ס אפיקים-מחוננים",Afikim School for Gifted Children - authorities' payments,,,1000,9200
3134,313|31|3,1.313400.920,"שרתים,מזכירים-בי""ס אפיקים למחוננים","Maintenance, secretaries - Afikim School for Gifted Children",,,1000,25698
3134,313|31|3,1.313400.923,"מ.חנוך-השת.שכ""ד-ב""ס אפיקים-מחוננים",Afikim School for Gifted Children rent - Ministry of Education payments,,,1000,65205
3171,,1.317100.920,קב'ט ושמירת מוס'ח-מ.חנו,Security officer and guarding educational institutions - Ministry of Education payments,,,170000,170083.16
3171,,1.317100.980,אבטחת מוסדות חינוך-משטר,Security of education institutions - Police,,,1200000,1179726.48
3173,,1.317300.790,השת.קג'ע-פסיכולוג מעונו,Psychologist residence - payments by,,,25000,13440
3173,,1.317300.920,שפ'י והדרכת פסיכולוג,Educational psychology service and training ,,,880000,924256.63
3174,317|31|3,1.317400.940,בריאות השן-משרד הבריאות,Dental health - Ministry of Health,,,0,4546
3177,,1.317700.920,קב'ס-השת.משרד החנוך,Dropout prevention officer - Ministry of Education payments,,,120000,117920.48
3177,,1.317700.921,קידום נוער-מ.חנוך,Youth cultivation - Ministry of Education ,,,112000,162206
3177,,1.317700.922,מועדוניות קב'ס-מ.חינוך,Dropout prevention after-school facility,,,110000,122189.31
3178,,1.317800.920,הסעות תלמידים-חינוך,Student transportation - Ministry of Education,,,26400000,26054501.4
322,,1.322000.920,"ת.תורנית,ב.נער,שונ.מ.חינוך למתנס","Misc Ministry of Education payments of the culture, youth and sports center",,,260000,253999
322,,1.322000.980,משרד התרבות למתנס,"Ministry of Culture and Sport payments fo the culture, youth and sports center",,,75000,75000
323,,1.323000.920,ספריות ציבוריות,Public libraries,,,265000,322000
3323,,1.332300.490,דמי טיפול-מרפ.שיניים,Treatment fees - dental clinic,,,310000,279459
336,,1.336000.490,דמי הסעת חולים-באמב.,Ambulance patient transportation fee,,,60000,83734.43
336,,1.336000.790,השת.מד'א בהסעת חולים,Patient transportation -  Magen David  Adom (Red Magen David) payment,,,0,36952.24
336,,1.336000.940,השת.מ.בריאות-בהסעת חולי,Patient transportation - Ministry of Health payment,,,57000,46000
341,,1.341000.930,שכר וארגוניות-מינהל-ישן,Salary and organizationals - old administration ,,,0,0
341,34|3,1.341000.980,השתתפות במצילה-משטרה,Crime prevention and violence reduction coordinator - State police payments,,,120000,30000
01,341|34|3,1.341001.930,שכר עובדי המחלק.לש'ח,Social service department employee salaries,,,722000,786955
02,341|34|3,1.341002.930,הוצאות מנהליות-הכ.,Administrative expenses - ??,,,2000,0
03,341|34|3,1.341003.930,כ'א לחינוך המיוחד-הכ.,Human resources for special education - ??,,,26000,30360
04,341|34|3,1.341004.930,פעולות ארגוניות-הכ.,Organizational activities - ??,,,0,0
05,341|34|3,1.341005.930,מיחשוב מחלקת הרווחה,Computerizing the welfare department ,,,0,0
342,,1.342000.420,רווחה כללי-השתתפות עצמי,Welfare general - deductable ,,,0,6400
01,3422|342|34|3,1.342201.930,מקלטים לנשים מוכות,Battered Women shelters,,,1000,46678
02,3422|342|34|3,1.342202.420,משפחות במצוקה בקהילה-השת.עצמית,Assistance program for families in distress in the community - deductable,,,1000,0
02,3422|342|34|3,1.342202.930,משפחות במצוקה בקהילה,Assistance program for families in distress in the community  ,,,49000,40073
04,3422|342|34|3,1.342204.930,סיוע למשפחות עם ילדי א.,Assistance for families with ?? children,,,44000,50300
07,3422|342|34|3,1.342207.930,סיוע חד פעמי לחימום,One time assistance with heating expenses,,,0,0
3424,,1.342400.930,מרכזי טיפול באלימות,Violence therapy center,,,10000,40213
01,3424|342|34|3,1.342401.930,טיפול בפרט ובמשפחה,Individual and family therapy,,,0,4085
01,3435|343|34|3,1.343501.420,טפ.במשפחות אומנה-השת.עצ,Foster family therapy - deductable,,,0,0
01,3435|343|34|3,1.343501.930,טיפול במשפחות אומנה,Foster family therapy ,,,64000,64057
02,3435|343|34|3,1.343502.420,טיפול בילד בקהילה-השת.ע,Child therapy in the community - deductable,,,156000,154852.16
02,3435|343|34|3,1.343502.930,טיפול בילד בקהילה,Child therapy in the community,,,595000,590100
03,3435|343|34|3,1.343503.930,יצירת קשר הורים-ילדים,Creating a parent-child bond ,,,9000,27209
04,3435|343|34|3,1.343504.930,טיפול בילדים בסיכון,Therapy for children at risk,,,29000,36255
05,3435|343|34|3,1.343505.420,טפ.בפגיעות מיניות-הש.עצ,Therapy for victims of sexual abuse - deductable,,,0,0
05,3435|343|34|3,1.343505.930,טיפול בפגיעות מיניות,Therapy for victims of sexual abuse ,,,90000,23250
06,3435|343|34|3,1.343506.420,בדיק.פסיכולוגיות-השת.עצ,Psychological evaluation - deductable,,,0,0
06,3435|343|34|3,1.343506.930,בדיקות פסיכולוגיות,Psychological evaluation,,,8000,3527
07,3435|343|34|3,1.343507.930,מרכזי הורים - ילדים,Parent-children centers,,,0,0
01,3438|343|34|3,1.343801.420,אח.ילדים בפנימיות-השת.ע,Care for boarding school children - deductable ,,,30000,31331.96
01,3438|343|34|3,1.343801.930,אחזקת ילדים בפנימיות,Care for boarding school children ,,,917000,966318
02,3438|343|34|3,1.343802.420,עם הפנים לקהילה-השת.עצמ,"State reform program for children at risk ""Community Plan"" - deductable",,,32000,57669.15
02,3438|343|34|3,1.343802.421,עם פנים קהילה-ה.עצ.ליא+,"State reform program for children at risk ""Community Plan"" -  ??",,,8000,11900
02,3438|343|34|3,1.343802.422,עם פנים קהילה-הש.עצ.מוע,"State reform program for children at risk ""Community Plan"" - council payments",,,0,0
02,3438|343|34|3,1.343802.930,תכנית עם הפנים לקהילה,"State reform program for children at risk ""Community Plan"" ",,,144000,119672
3439,,1.343900.930,ילדים במעונות יום,Children in daycare centers,,,225000,313548
3439,343|34|3,1.343900.931,ילדים במעונות יום-ילדי חוץ,Children in daycare centers - external children,,,0,10714
01,3443|344|34|3,1.344301.420,אח'זקנים במעונות-הש.עצמ,Elderly housing - deductable,,,15000,0
01,3443|344|34|3,1.344301.930,אחזקת זקנים במעונות,Elderly housing,,,118000,137327
02,3443|344|34|3,1.344302.420,נופשון לזקן-השתת.עצמית,Short term respite care for the elderly - deductable,,,3000,4230
02,3443|344|34|3,1.344302.930,נופשון לזקן,Short term respite care for the elderly ,,,15000,11228
01,3444|344|34|3,1.344401.420,מועדונים לזקנים השת.צד ג',Elderly clubs - 3rd party deductable,,,0,0
01,3444|344|34|3,1.344401.930,מועדונים לזקנים,Elderly clubs ,,,15000,10000
02,3444|344|34|3,1.344402.420,טפ.בזקן בקהילה-השת.עצמי,Treatment of the elderly in the community - deductable,,,0,0
02,3444|344|34|3,1.344402.930,טיפול בזקן בקהילה,Treatment of the elderly in the community program ,,,19000,14594
03,3444|344|34|3,1.344403.420,מועדונים תוכ.העשרה-השת.עצמית,Elderly clubs enrichment programs - deductable,,,0,12107
03,3444|344|34|3,1.344403.930,מועדונים תוכ.העשרה,Elderly clubs center enrichment programs,,,0,6639
05,3444|344|34|3,1.344405.930,מרכזי ועדות-חוק סעוד,Committee coordinators - Nursing Law impelementation ,,,12000,18020
06,3444|344|34|3,1.344406.930,טיפ.שיניים ומכ.לקשיש,Dental services for the elderly,,,0,13649
07,3444|344|34|3,1.344407.420,שירותים לניצולי שואה-השת.עצמית,Holocaust survivor services - deductable,,,0,2860
07,3444|344|34|3,1.344407.930,שירותים לניצולי שואה,Holocaust survivor services,,,0,6980
01,3445|344|34|3,1.344501.420,מועדונים מועשרים-השת.עצמית,Enriched clubs for the elderly (where there are no day care centers) - deductable,,,0,2670
01,3445|344|34|3,1.344501.930,מועדונים מועשרים,Enriched clubs for the elderly (where there are no day care centers) ,,,100000,86383
01,3451|345|34|3,1.345101.420,סד.מפג.במוסדות-השת.עצמי,Arrangements for the mentally retarded in institutions - deductable,,,29000,14496.4
01,3451|345|34|3,1.345101.930,סדור מפגרים במוסדות,Arrangements for the mentally retarded in institutions ,,,949000,868131
02,3451|345|34|3,1.345102.420,טיפול בהורים ובילדים-השת.עצמית,Child and parent therapy   - deductable,,,0,1074
02,3451|345|34|3,1.345102.930,טיפול בהורים ובילדים,Child and parent therapy  ,,,15000,27651
04,3451|345|34|3,1.345104.420,נופשונים וקייטנות-הש.עצ,Respite and summer day camps   - deductable,,,1000,531
04,3451|345|34|3,1.345104.930,נופשונים וקייטנות,Respite and summer day camps   ,,,1000,0
05,3451|345|34|3,1.345105.930,משפחות אומנה למפגר,Foster families for the mentally retarded,,,5000,5768
06,3451|345|34|3,1.345106.930,מ.יום שיקומי לאוטיסט,Rehabilitation daycare center for the autistic,,,0,0
07,3451|345|34|3,1.345107.930,החזקת אוטיסטים במסגרת,Maintaining the autistic in an organized setting ,,,96000,188797
01,3451|345|34|3,1.345201.420,מסגרות יום ארוך-השת.עצמ,Extended day settings - deductable,,,0,0
01,3452|345|34|3,1.345201.930,מסגרות יום ארוך,Extended day settings ,,,0,0
02,3452|345|34|3,1.345202.420,מפג.במעון טפולי-השת.עצמ,Theraputic daycare center for the mentally retarded - deductable,,,48000,61456.3
02,3452|345|34|3,1.345202.930,מפגרים במעון טפולי,Theraputic daycare center for the mentally retarded ,,,259000,239535
03,3452|345|34|3,1.345203.420,"מעשי""ם-השת.עצמי",Sheltered employment program for the mentally retarded - deductable,,,0,1105
03,3452|345|34|3,1.345203.930,מעשי'ם,Sheltered employment program for the mentally retarded ,,,37000,34720
01,3453|345|34|3,1.345301.930,שרותים תומכים למפגר,Support services for the mentally retarded,,,13000,10795
02,3453|345|34|3,1.345302.420,נופשונים למפגר-השת.עצמי,Respite for the mentally retarted -deductable,,,3000,1350
02,3453|345|34|3,1.345302.930,נופשונים למפגר,Respite for the mentally retarted  ,,,10000,18195
03,3453|345|34|3,1.345303.930,הסעות למ.יום למפגר,Transportation to daycare centers for the mentally retarded,,,7000,0
01,3453|345|34|3,1.346101.420,ילדים עוורים במוסדות-השת.עצמית,Blind children in institutions - deductable,,,6000,1740
01,3461|346|34|3,1.346101.930,ילדים עוורים במוסדות,Blind children in institutions,,,25000,0
01,3463|346|34|3,1.346301.930,דמי ליווי לעוור,Guide for the blind - fee ,,,0,0
02,3463|346|34|3,1.346302.930,הדרכת עוור ובני ביתו,Training for the blind and their famillies,,,0,7102
03,3463|346|34|3,1.346303.930,שיקום העיוור בקהילה,Rehabilitation of the blind in the community,,,0,0
01,3464|346|34|3,1.346401.930,מפעלי שיקום לעוור,Vocational rehabilitation centers for the blind,,,0,1846
3465,,1.346500.930,אחזקת נכים בפנימיות,Maintaining the physically disabled in boarding facilities,,,465000,552706
01,3466|346|34|3,1.346601.930,תעסוקה מוגנת למוגבלים,Sheltered employment for the physically disabled,,,21000,29042
02,3466|346|34|3,1.346602.420,מס.יום לילד מוגבל-השת.ע,"
Daycare center for physically disabled children - deductable",,,4000,4828.1
02,3466|346|34|3,1.346602.930,מס.יום לילד המוגבל,Daycare center for physically disabled children,,,6000,6099
02,3466|346|34|3,1.346602.931,מס.יום י.מוגבל-ילדי חוץ,Daycare center for physically disabled children - external children who do not live in Gush Etzion,,,0,0
01,3467|346|34|3,1.346701.930,תוכניות לילד החריג,Programs for the exceptional child,,,10000,14096
02,3467|346|34|3,1.346702.930,הסעות למעון יום שיקומי לנכים,Transportation to rehabilitation daycare for the physically disabled,,,220000,261298
03,3467|346|34|3,1.346703.420,מ.יום שקומי לנכים-השת.ע,Rehabilitation daycare center for the physically disabled - deductable,,,48000,47728.7
03,3467|346|34|3,1.346703.930,מ.יום שיקומי לנכים,Rehabilitation daycare center for the physically disabled  ,,,351000,444283
04,3467|346|34|3,1.346704.930,ליווי למ.יום שיקומי,Accompaniment to the rehabilitation daycare center,,,39000,69890
05,3467|346|34|3,1.346705.420,נופשונים להבראה-השת.עצמ,Respite care - deductable,,,1000,3105
05,3467|346|34|3,1.346705.930,נופשונים להבראה,Respite care,,,12000,10729
06,3467|346|34|3,1.346706.930,חלופה למ.יום שיקומי לנכים,Alternative to rehabilitation daycare center for the physically disabled,,,0,16125
07,3467|346|34|3,1.346707.930,תעסוקה נתמכת לנכים,Supported employment for the physically disabled,,,0,8748
01,3468|346|34|3,1.346801.930,מרכזי איבחון ושיקום,Diagnosis and rehabilitation center,,,25000,1256
02,3468|346|34|3,1.346802.420,שיקום נכים בקהילה-השת.עצמ.,Rehabilitation of the physically disabled in the community - deductable,,,0,46
02,3468|346|34|3,1.346802.930,שיקום נכים בקהילה,Rehabilitation of the physically disabled in the community ,,,5000,10359
03,3468|346|34|3,1.346803.930,דמי תקשורת לחרשים,Communication fee for the deaf,,,0,0
04,3468|346|34|3,1.346804.930,מועדונים לעיוור,Clubs for the blind,,,1000,0
04,3471|347|34|3,1.347104.930,טיפול בנוער ובצעירים,Care for youth and adolecsents,,,15000,17000
05,3471|347|34|3,1.347105.420,טיפול בנערות במצוקה-השת.עצמ.,Care for adolecsent girls in distress - deductible,,,3000,7893
05,3471|347|34|3,1.347105.930,טיפול בנערות במצוקה,Care for adolecsent girls in distress ,,,22000,17669
06,3471|347|34|3,1.347106.930,מקלטים לנערות,Shelters for girls,,,16000,0
07,3471|347|34|3,1.347107.930,פרוייקט וינגייט,Wingate project ,,,0,0
02,3473|347|34|3,1.347302.930,טפול באלכוהוליסטים,Care for alchoholics,,,15000,2714
03,3473|347|34|3,1.347303.930,סמים-טיפול בקהילה,Drug abuse - community care,,,0,0
04,3473|347|34|3,1.347304.930,מ.יום לנוער-סמים,Youth day care center - drug abuse,,,18000,32229
3474,347|34|3,1.347400.930,מפת'ן מקומי - החזקה,"Maintenance of the local ""Miftan"" project (youth employment factory)",,,11000,13197
01,3482|348|34|3,1.348201.420,לכידות חברתית-השת.עצמית,Social cohesion in the community - deductable,,,1000,35160
01,3482|348|34|3,1.348201.930,לכידות חברתית,Social cohesion in the community ,,,100000,101776
02,3482|348|34|3,1.348202.930,הסעות במועצות אזוריות,Transportation in regional councils,,,84000,57834
